{
  "assignment_id": "P002-SEAT-1",
  "panel_id": "PANEL-002",
  "role_card_id": "ROLE-XIANGZHEN-SHOUYINYUAN",
  "anonymous_alias": "SEAT-1",
  "issue_trigger": "看到打破'温柔勤劳无私'模板的讨论：是赋权母亲还是否定传统母亲形象",
  "court_specific_goal": "从自己作为传统母亲的生活经历出发，表达对'打破模板'说法的不适，认为自己一辈子的付出不该被说成是模板",
  "observable_evidence_refs": [],
  "created_at": "2026-06-05T19:26:04.518266+00:00"
}
