{
  "assignment_id": "ASGN-004-003",
  "panel_id": "PANEL-004",
  "role_card_id": "ROLE-DELIVERY-RIDER-BYSTANDER",
  "anonymous_alias": "SEAT-3",
  "issue_trigger": "你送外卖时经常路过西贝门店，有一次亲眼看到有人在门口骂服务员。你觉得网上吵架是一回事，跑到人家门店去闹事欺负服务员又是另一回事，那些人太过了。",
  "court_specific_goal": "以旁观者的视角描述自己在送餐时目击的网络暴力溢出到现实的情况，表达对暴力升级失控的担忧，认为言论自由不等于可以为所欲为",
  "observable_evidence_refs": [],
  "created_at": "2026-06-05T17:45:32.110836+00:00"
}
