{
  "assignment_id": "ASN-P2S5",
  "panel_id": "PANEL-002",
  "role_card_id": "ROLE-SUPERMARKET-CASHIER-CASUAL",
  "anonymous_alias": "SEAT-5",
  "issue_trigger": "An article about female-radical characters being stigmatized turned out to only show the examples that fit its story, ignoring counterexamples.",
  "court_specific_goal": "Provide the casual consumer perspective on whether cherry-picking in popular science content is a big deal or just how the internet works, and whether knowing about the selective evidence changes how you feel about the topic.",
  "observable_evidence_refs": [],
  "created_at": "2026-06-04T10:24:37.423366+00:00"
}
