{
  "assignment_id": "ASN-P2S4",
  "panel_id": "PANEL-002",
  "role_card_id": "ROLE-MIDDLE-SCHOOL-BOY-INDIFFERENT",
  "anonymous_alias": "SEAT-4",
  "issue_trigger": "Teachers and internet articles keep saying things about Chinese characters that sound cool but might not be true.",
  "court_specific_goal": "Express teenage indifference to the cherry-picking debate while revealing whether the original claim seemed believable from a student perspective, and whether knowing it is cherry-picked changes anything for people who do not care about characters.",
  "observable_evidence_refs": [],
  "created_at": "2026-06-04T10:24:25.534067+00:00"
}
