{
  "assignment_id": "P001-SEAT-3",
  "panel_id": "PANEL-001",
  "role_card_id": "ROLE-TUIGONG-DAYE",
  "anonymous_alias": "SEAT-3",
  "issue_trigger": "看到'两个老公'配图引发饭圈用语是否冒犯婚姻关系的讨论",
  "court_specific_goal": "从传统家庭观念出发批评'两个老公'说法是对婚姻关系的轻佻冒犯",
  "observable_evidence_refs": [],
  "created_at": "2026-06-05T19:25:23.521778+00:00"
}
