{
  "assignment_id": "ASGN-003-002",
  "panel_id": "PANEL-003",
  "role_card_id": "ROLE-FOODIE-BLOGGER-HONEST-EXTREME",
  "anonymous_alias": "SEAT-2",
  "issue_trigger": "你作为美食博主，长期关注餐饮行业的透明度问题。西贝说明厨亮灶就够了，但你做过的测评发现明厨亮灶只展示门店最后操作，中央厨房的预处理环节消费者完全看不到。",
  "court_specific_goal": "用专业博主的真实测评案例说明明厨亮灶的局限性，揭示餐饮行业用锅气香精等手段欺骗消费者的普遍现象，推动消费者知情权的实质保障",
  "observable_evidence_refs": [],
  "created_at": "2026-06-05T17:43:20.179190+00:00"
}
