{
  "assignment_id": "ASGN-001-005",
  "panel_id": "PANEL-001",
  "role_card_id": "ROLE-data-analyst-reactive",
  "anonymous_alias": "SEAT-5",
  "issue_trigger": "注意到舆论对'阶层消费'的标签化讨论缺乏数据支撑，原始视频和切片传播存在信息差",
  "court_specific_goal": "用逻辑分析拆解'阶层消费'标签是否成立，区分内容创作动机和传播扭曲",
  "observable_evidence_refs": [],
  "created_at": "2026-06-06T00:37:35.620376+00:00"
}
