{
  "assignment_id": "P002-SEAT-01",
  "panel_id": "PANEL-002",
  "role_card_id": "ROLE-YOUNG-DAD-LOYAL-SUPPORTER",
  "anonymous_alias": "SEAT-01",
  "issue_trigger": "看到姐姐刘某替弟弟发声觉得可以理解，但曝光别人私人信息确实不对",
  "court_specific_goal": "以同理心为通报的定性辩护，理解姐姐的悲痛但不支持网络曝光行为，呼吁理性表达",
  "observable_evidence_refs": [],
  "created_at": "2026-06-05T12:29:28.207374+00:00"
}
