{
  "assignment_id": "ASGN-001-006",
  "panel_id": "PANEL-001",
  "role_card_id": "ROLE-SUPERMARKET-CASHIER-CASUAL",
  "anonymous_alias": "SEAT-6",
  "issue_trigger": "你在超市冷鲜区旁边上班，看到预制菜的货架越来越多，顾客买得也越来越多。听说西贝和罗永浩因为预制菜定义吵起来了，你觉得这事儿挺有意思的。",
  "court_specific_goal": "从日常接触预制菜产品的零售从业者角度，分享对消费趋势的观察，用朴素的直觉判断法规定义和消费者认知的矛盾",
  "observable_evidence_refs": [],
  "created_at": "2026-06-05T17:41:45.787363+00:00"
}
