{
  "assignment_id": "P001-SEAT-2",
  "panel_id": "PANEL-001",
  "role_card_id": "ROLE-PINPAI-ZHONGCHENG-FEN",
  "anonymous_alias": "SEAT-2",
  "issue_trigger": "看到'两个老公'配图引发饭圈用语是否冒犯婚姻关系的讨论",
  "court_specific_goal": "从品牌粉丝角度辩护这次营销活动的创意意图，认为外界过度解读了饭圈用语",
  "observable_evidence_refs": [],
  "created_at": "2026-06-05T19:25:15.689644+00:00"
}
